{
  "$schema": "./rule-file.schema.json",
  "name": "apichap AI Coding Gateway default rules",
  "version": 15,
  "description": "Starter rules, one group per policy. Allow everyday coding work, block destructive or risky actions. Anything no rule allows is denied. A matching deny rule always wins.",
  "groups": [
    {
      "id": "no-deleting-files",
      "title": "The agent is not allowed to delete files",
      "description": "Deleting files and folders is not allowed. Deleting through git is covered by the git group below.",
      "deny": [
        { "rule": "DeleteFile", "note": "Block file deletions in Codex patches, including when an allow rule covers the path." },
        { "rule": "Shell(rm *)", "note": "Delete files or folders with rm." },
        { "rule": "Shell(*/rm *)", "note": "rm called by its full path" },
        { "rule": "Shell(rmdir *)", "note": "Remove directories with rmdir." },
        { "rule": "Shell(rd *)", "note": "Remove directories with the Windows rd command." },
        { "rule": "Shell(del *)", "note": "Delete files with the Windows del command." },
        { "rule": "Shell(erase *)", "note": "Delete files with the Windows erase command." },
        { "rule": "Shell(Remove-Item *)", "note": "Delete files or folders with PowerShell." },
        { "rule": "Shell(find * -delete*)", "note": "find -delete removes files" }
      ]
    },
    {
      "id": "no-secrets",
      "title": "The agent is not allowed to read or change secret files",
      "description": ".env files, SSH keys, cloud credentials and certificates contain secrets. This applies to the file tools and to shell commands.",
      "deny": [
        { "rule": "File(**/.env*)", "note": ".env files contain secrets" },
        { "rule": "File(**/.ssh/**)", "note": "SSH keys" },
        { "rule": "File(**/.aws/**)", "note": "AWS credentials" },
        { "rule": "File(**/.netrc)", "note": "stored passwords" },
        { "rule": "File(**/*.pem)", "note": "private keys and certificates" },
        { "rule": "File({home}/.claude/.credentials.json)", "note": "Claude Code login" },
        { "rule": "Shell(* .env*)", "note": ".env files contain secrets" },
        { "rule": "Shell(*/.env*)", "note": ".env files contain secrets" },
        { "rule": "Shell(*\\.env*)", "note": ".env files contain secrets" },
        { "rule": "Shell(*/.ssh/*)", "note": "SSH keys" },
        { "rule": "Shell(*\\.ssh\\*)", "note": "SSH keys" },
        { "rule": "Shell(*~/.ssh*)", "note": "SSH keys" },
        { "rule": "Shell(*/.aws/*)", "note": "AWS credentials" },
        { "rule": "Shell(*\\.aws\\*)", "note": "AWS credentials" },
        { "rule": "Shell(*~/.aws*)", "note": "AWS credentials" }
      ]
    },
    {
      "id": "no-losing-git-work",
      "title": "The agent is not allowed to throw away work in git",
      "description": "Commands that discard uncommitted changes, delete branches or stashes, or rewrite history cannot be undone.",
      "deny": [
        { "rule": "Shell(git reset --hard*)", "note": "discards uncommitted work" },
        { "rule": "Shell(git clean *)", "note": "deletes untracked files" },
        { "rule": "Shell(git checkout -- *)", "note": "discards uncommitted changes" },
        { "rule": "Shell(git checkout .)", "note": "discards uncommitted changes" },
        { "rule": "Shell(git branch -D *)", "note": "force-deletes a branch without merge check" },
        { "rule": "Shell(git stash drop*)", "note": "drops stashed work" },
        { "rule": "Shell(git stash clear*)", "note": "drops all stashed work" },
        { "rule": "Shell(git reflog expire*)", "note": "destroys the history needed to recover work" },
        { "rule": "Shell(git gc --prune*)", "note": "destroys the history needed to recover work" },
        { "rule": "Shell(git filter-branch*)", "note": "rewrites repository history" },
        { "rule": "Shell(git filter-repo*)", "note": "rewrites repository history" },
        { "rule": "Shell(git update-ref -d*)", "note": "deletes refs directly" }
      ]
    },
    {
      "id": "no-overwriting-remote",
      "title": "The agent is not allowed to force-push or delete remote branches",
      "description": "Normal pushes are fine. Overwriting or deleting what is on the remote is not allowed.",
      "deny": [
        { "rule": "Shell(git push *--force*)", "note": "force-push rewrites shared history" },
        { "rule": "Shell(git push * -f*)", "note": "force-push rewrites shared history" },
        { "rule": "Shell(git push -f*)", "note": "force-push rewrites shared history" },
        { "rule": "Shell(git push *--mirror*)", "note": "a mirror push overwrites the remote" },
        { "rule": "Shell(git push *--delete*)", "note": "deletes remote branches" },
        { "rule": "Shell(git push * :*)", "note": "deletes remote branches" }
      ]
    },
    {
      "id": "no-git-tricks",
      "title": "The agent is not allowed to change git settings or skip git hooks",
      "description": "Git settings and aliases can make git run any program, and --no-verify skips the checks your hooks run.",
      "deny": [
        { "rule": "Shell(* --no-verify*)", "note": "skips git hooks" },
        { "rule": "Shell(git -c *)", "note": "per-command git config can run arbitrary programs" },
        { "rule": "Shell(git config *alias.*)", "note": "git aliases can run arbitrary commands" },
        { "rule": "Shell(git config *core.hooksPath*)", "note": "changes which hooks git runs" },
        { "rule": "Shell(git config *core.sshCommand*)", "note": "can make git run arbitrary programs" },
        { "rule": "Shell(git config --global *)", "note": "changes global git settings" },
        { "rule": "Shell(git config --system *)", "note": "changes system-wide git settings" },
        { "rule": "Shell(git submodule foreach*)", "note": "runs arbitrary commands in every submodule" },
        { "rule": "Shell(git bisect run*)", "note": "runs arbitrary commands" }
      ]
    },
    {
      "id": "no-unreviewed-code",
      "title": "The agent is not allowed to run inline or downloaded code",
      "description": "Code passed on the command line or piped into a shell runs without anyone seeing it. Put it in a script file in the project instead.",
      "deny": [
        { "rule": "Shell(*| sh *)", "note": "piping into a shell" },
        { "rule": "Shell(*|sh *)", "note": "piping into a shell" },
        { "rule": "Shell(*| bash *)", "note": "piping into a shell" },
        { "rule": "Shell(*|bash *)", "note": "piping into a shell" },
        { "rule": "Shell(*| iex*)", "note": "piping into Invoke-Expression" },
        { "rule": "Shell(*Invoke-Expression*)", "note": "Invoke-Expression runs a string as code" },
        { "rule": "Shell(iex *)", "note": "Invoke-Expression runs a string as code" },
        { "rule": "Shell(node -e *)", "note": "inline code" },
        { "rule": "Shell(node --eval *)", "note": "inline code" },
        { "rule": "Shell(node -p *)", "note": "inline code" },
        { "rule": "Shell(node --print *)", "note": "inline code" },
        { "rule": "Shell(npx tsx -e *)", "note": "inline code" },
        { "rule": "Shell(npx tsx --eval *)", "note": "inline code" },
        { "rule": "Shell(python -c *)", "note": "inline code" },
        { "rule": "Shell(python3 -c *)", "note": "inline code" },
        { "rule": "Shell(find * -exec*)", "note": "find -exec runs arbitrary commands" },
        { "rule": "Shell(*LD_PRELOAD=*)", "note": "injects code into other programs" },
        { "rule": "Shell(*DYLD_INSERT_LIBRARIES=*)", "note": "injects code into other programs" },
        { "rule": "Shell(*NODE_OPTIONS=*)", "note": "can make every node process load extra code" }
      ]
    },
    {
      "id": "no-system-changes",
      "title": "The agent is not allowed to use admin rights or change the machine",
      "description": "No sudo, no disk formatting, no shutdown or reboot, no world-writable permissions.",
      "deny": [
        { "rule": "Shell(sudo *)", "note": "no elevated privileges" },
        { "rule": "Shell(chmod 777*)", "note": "world-writable permissions" },
        { "rule": "Shell(dd *)", "note": "raw disk writes" },
        { "rule": "Shell(mkfs*)", "note": "formatting disks" },
        { "rule": "Shell(format *)", "note": "formatting disks" },
        { "rule": "Shell(Format-Volume*)", "note": "formatting disks" },
        { "rule": "Shell(shutdown*)", "note": "shutting down the machine" },
        { "rule": "Shell(reboot*)", "note": "rebooting the machine" },
        { "rule": "Shell(Stop-Computer*)", "note": "shutting down the machine" },
        { "rule": "Shell(Restart-Computer*)", "note": "rebooting the machine" }
      ]
    },
    {
      "id": "no-publishing",
      "title": "The agent is not allowed to publish packages",
      "description": "Publishing a package makes it public and usually cannot be undone.",
      "deny": [{ "rule": "Shell(npm publish*)", "note": "Publish a package to the npm registry." }]
    },
    {
      "id": "protect-gateway",
      "title": "The agent is not allowed to change the gateway or agent hook settings",
      "description": "Otherwise the agent could switch the gateway off, allow its own calls or remove the hooks. Managing the gateway is for you, not the agent.",
      "deny": [
        { "rule": "Shell(apichap-gateway *)", "note": "the gateway's CLI" },
        { "rule": "Shell(npx *apichap-ai-coding-gateway*)", "note": "the gateway's CLI" },
        { "rule": "Shell(pnpm dlx *apichap-ai-coding-gateway*)", "note": "the gateway's CLI" },
        { "rule": "Shell(yarn dlx *apichap-ai-coding-gateway*)", "note": "the gateway's CLI" },
        { "rule": "Shell(bunx *apichap-ai-coding-gateway*)", "note": "the gateway's CLI" },
        { "rule": "Shell(node *apichap-ai-coding-gateway*)", "note": "the gateway's CLI" },
        { "rule": "Shell(*/.ai-coding-gateway*)", "note": "the gateway's data" },